{
  "context_package_id": "ctx_123",
  "version": 7,
  "created_at": "2026-07-01T01:00:00Z",
  "items": [
    {
      "type": "requirement",
      "ref": "artifact://requirements/auth-v3",
      "required": true,
      "label": "Approved requirements"
    },
    {
      "type": "repository_slice",
      "ref": "repo://service/auth",
      "required": true
    },
    {
      "type": "decision_record",
      "ref": "artifact://adr/0042",
      "required": true
    }
  ],
  "integrity": {
    "digest": "sha256:1111111111111111111111111111111111111111111111111111111111111111"
  }
}
